{"assurance_results":[{"assumptions":["declared single-evaluator model"],"claim_id":"composition-privacy","code_digest":null,"evidence_paths":["research/assurance/composition.json"],"id":"assurance.composition","implementation_refinement":"tested_differential","origin":"solver_executed","outcome":"proved_in_model","schema_version":"pllm.assurance_result.v1","scope":"masked-linear@1/core-wrap32@1","tool":"fixture-checker","tool_version":"1"}],"candidate_evidence":[{"assurance_results":[{"digest":"75618d145fe93a7ecdd56bcb7e53a64eb4904ace2d0915946823d8c5b87376ef","id":"assurance.composition"}],"kernel_artifact_digest":"cccccccccccccccccccccccccccccccccccccccccccccccccccccccccccccccc","kernel_id":"core-wrap32","kernel_version":"1","method_artifact_digest":"bbbbbbbbbbbbbbbbbbbbbbbbbbbbbbbbbbbbbbbbbbbbbbbbbbbbbbbbbbbbbbbb","method_id":"masked-linear","method_version":"1"}],"configuration":{"budget":{"max_input_tokens":128,"max_new_tokens":32,"requests":1},"deployment":{"kind":"local","root":".pllm/qwen-local"},"name":"qwen-local","pipeline":{"components":{"inference":{"component":"pllm/inference","params":{}},"kernels":{"component":"pllm/cpu","params":{"threads":4}},"linear":{"component":"pllm/masked-linear","params":{}},"preparation":{"component":"pllm/model-aware-corrections","params":{}}},"model":{"source":"Qwen/Qwen2.5-0.5B-Instruct"}},"schema":"pllm.experiment.v2"},"context":{"compiler":{"digest":"aaaaaaaaaaaaaaaaaaaaaaaaaaaaaaaaaaaaaaaaaaaaaaaaaaaaaaaaaaaaaaaa","id":"pllm/compiler","version":"0.17.0-alpha.1"},"composition_digest":"b8531d93f0bdc4ca759981903aa67ccc726ff5652ba59c714af468b60593cd8c","execution_role":"inference","material_requests":[{"digest":"8888888888888888888888888888888888888888888888888888888888888888","id":"material.mask"}],"model":{"digest":"1111111111111111111111111111111111111111111111111111111111111111","id":"model.fixture"},"numeric_graph":{"digest":"f21bdf63a267cae97ee0044be6d2c4cacea453ded2a6ac4ca93b2dfaa7206fe7","id":"numeric.wrap32"},"privacy_contract":{"digest":"5367e147dcd6d2d8b7d921a2f62fb7aa99f72321048ff906f945129517e0353b","id":"privacy.single-evaluator"},"protected_graph":{"digest":"a055e7abd50b34358f78f5ab766579e3882576f1cf4f0384929e39c061e1ea38","id":"protected.masked-ring"},"resource_forecast":{"digest":"9999999999999999999999999999999999999999999999999999999999999999","id":"resources.fixture"},"roles":["client","inference","preparation"],"schema_version":"pllm.locked_context.v2","semantic_graph":{"digest":"8f2ef49af9afe84db628d8873d23bc933edc2d8782372ba2fcc1de8d4aedafea","id":"semantic.linear"},"static_role_plans":[{"digest":"dddddddddddddddddddddddddddddddddddddddddddddddddddddddddddddddd","role":"client"},{"digest":"eeeeeeeeeeeeeeeeeeeeeeeeeeeeeeeeeeeeeeeeeeeeeeeeeeeeeeeeeeeeeeee","role":"preparation"}],"target":{"digest":"7777777777777777777777777777777777777777777777777777777777777777","id":"target.cpu"},"tokenizer":{"digest":"2222222222222222222222222222222222222222222222222222222222222222","id":"tokenizer.fixture"},"workload":{"digest":"6666666666666666666666666666666666666666666666666666666666666666","id":"workload.fixture"}},"input":{"numeric":"wrap32","shape":[2,3]},"input_representation":"masked_ring","kernels":[{"artifact_digest":"cccccccccccccccccccccccccccccccccccccccccccccccccccccccccccccccc","id":"core-wrap32","implementation":"pllm_core_matrix_wrap32","input_numeric":"wrap32","method_id":"masked-linear","method_version":"1","output_numeric":"wrap32","version":"1"}],"methods":[{"artifact_digest":"bbbbbbbbbbbbbbbbbbbbbbbbbbbbbbbbbbbbbbbbbbbbbbbbbbbbbbbbbbbbbbbb","id":"masked-linear","input_representation":"masked_ring","operator":"linear","output_representation":"masked_ring","properties":{"experimental":false,"needs_client_weights":false,"needs_online_preparation":false,"online_parties":1,"uses_he":false},"version":"1"}],"operations":[{"id":"linear-0","input_representation":"masked_ring","operator":"linear","output":{"numeric":"wrap32","shape":[2,2]},"output_representation":"masked_ring"}],"output":{"numeric":"wrap32","shape":[2,2]},"output_representation":"masked_ring","privacy_contract":{"allow_client_weights":false,"allow_experimental":false,"allow_he":false,"allow_online_preparation":false,"id":"privacy.single-evaluator","online_parties":1,"required_claims":[{"accepted_implementation_refinements":["tested_differential","proved_for_locked_code"],"accepted_outcomes":["proved_in_model"],"claim_id":"composition-privacy"}],"schema_version":"pllm.privacy_contract.v1"},"schema_version":"pllm.compile_request.v2"}